{
  "packet_version": "1.0",
  "created_at": "2025-12-13",
  "book": {
    "book_number": 1,
    "title": "Book 1: The Foundation Block",
    "description": "Basketball story that teaches core coding foundations, then proves it with a quick game challenge.",
    "grade_bands": ["3-5", "6-8"],
    "curriculum": {
      "phase_path": ["blocks", "bridge", "python"],
      "primary_concepts": ["state", "sequences"],
      "standards_tags": ["CSTA-1B", "CSTA-2"]
    }
  },
  "commerce": {
    "channel_priority": ["schools", "parents"],
    "school": {
      "pilot_cta": "Request a Pilot",
      "sales_contact_email": "schools@ballcode.co",
      "offer_ladder_ref": "documents/OFFER-LADDER-SCHOOL-FIRST.md"
    },
    "consumer": {
      "enabled": true,
      "price_usd": 5,
      "purchase_url": "https://gumroad.com/l/your-link"
    }
  },
  "assets": {
    "thumbnail_path": "../BallCode/assets/images/video-poster.png",
    "video_path": ""
  },
  "website": {
    "index_card_badge": "Available",
    "cta_label": "Buy Book 1 â†’"
  },
  "game": {
    "launch_url": "ballcode.co/play?book=1&level=1&mode=blockcoding",
    "levels": [
      {
        "level_id": "book1_coding_1_2",
        "mode": "blockcoding",
        "duration_seconds": 90
      }
    ]
  }
}
